<?xml version='1.0'?>
<!DOCTYPE ctrl_params>
<!-- SYSTEM "../dtd/ctrl_params.dtd" -->
<ctrl_params xmlns:xsi="http://www.w3.org/2001/XMLSchema-instance" xsi:noNamespaceSchemaLocation="ctrl_params.xsd">
	<submission_method name="oarsh"/>
	<transfer_files method="oarcp" type="data,exe" binlib_in_commondir="false" destdir="scratch" />
	<envs>
	    <env name="LD_LIBRARY_PATH" value="${LD_LIBRARY_PATH}" action="add"/>
	    <env name="CLASSPATH" value="${CLASSPATH}" action="add"/>
	</envs>	
	<planner mode="RR"/>
	<placement_constraints> ${placement_constraints} </placement_constraints>
</ctrl_params>
